,text
372,mantab pak tri erickthohir nadiem makarim ngelawak ala budaya betawi moga terus inspirasi untuk generasi muda indonesia
373,bila menteri muda jokowi komedi
374,selundup di garuda sebut sistemik menteri bumn kolaborasi dalam jahat
375,suami iis dahlia pilot pesawat garuda yang angkut harley dan brompton selundup  
376,dengan masuk pria lahir agustus sebut erick harap bank mandiri tak hanya unggul di dalam negeri tetapi juga jadi main financial service yang segani di asia tenggara lengkap
377,dirut garuda copot sahabat erick thohir sandiaga uno minta ari askhara tak dibully habis via
378,erick thohir sebut royke tumilaar dirut bank mandiri ini profil
379,royke tumilaar tunjuk jadi dirut bank mandiri telah erick thohir angkat ahok copot ari askhara via
380,mantan menteri uang ri muhammad chatib basri tunjuk erick thohir jadi komisaris utama mandiri
381,aaahhh kerreennn siih ini paraaahh komentar
382,menteri bumn erick thohir sedang jadi media darling belakang ini sejak pilih jadi menteri bumn yang umum bulan oktober oleh presiden jokowi erick thohir segera tancap gas laku jumlah gebrak
383,ini kronologi kuak selundup komponen harley davidson hingga menteri bumn erick thohir harus henti dirut garuda indonesia
384,belum makan dari pagimasih lapar
385,semenjak dirut garuda jadi ketua inaca harga tiket pesawat langsung lonjak naik macam dalih spt maskapai terus rugi nyata semua main dan hari ini dirut garuda di pecat karena seludup
386,aku aneh bawa harley davidson di pesawat baru garuda
387,video erick thohir pecat dirut garuda
388,resmi menteri bumn erick thohir pecat dirut garuda indonesia ari ashkara garagara kasus ini via
389,ahok dibully menteri bumn erick thohir tawar jabat untuk sandiaga uno najwa shihab saksi
390,beberapa jenis kue basah dan cara buat
391,oknum bos garuda indonesia minta mundur hari ini juga erick thohir bukti luar biasa via
392,tidak bisa mohon maaf kalau salah ya ngaku salah
393,siap sentil garuda soal onderdil harley menteri bumn kita tunggu dulu bea cukai
394,mata najwa tadi malam erick thohir hadap hal buruk ini usai jadi menteri bumn respon najwa shihab
395,sedang langsung live streaming mata najwa trans menteri bumn erick thohir buka suara via
396,link live streaming trans mata najwa menteri bumn erick thohir hadir bahas bisnis negara via
397,bikin bingung menteri erick thohir ini daftar bumn yang punya bisnis hotel siapa paling banyak via
398,selain mereview anak dan cucu usaha bumn erick thohir juga rencana henti bentuk superholding bumn seperti yang telah lama wacana oleh menteri bumn belum rini soemarno
399,hari erick thohir jabat menteri bumn telah isu ahok kini ancam pecat direksi garuda indonesia via
400,malam ini live streaming mata najwa demi bisnis negara menteri bumn erick thohir siap buka via
401,erick thohir window dressing lapor uang bisa juga kategori bagai tindak pidana alias kriminal
402,erick thohir window dressing lapor uang bisa juga kategori bagai tindak pidana alias kriminal
403,jalan tol dalkot gratis lama jam menteri bumn sesuai arah presiden untuk segera laku tindak yang perlu demi kurang beban masyarakat yang dampak banjir
404,jalan tol dalkot gratis lama jam menteri bumn sesuai arah presiden untuk segera laku tindak yang perlu demi kurang beban masyarakat yang dampak banjir
405,presiden jokowi instruksi menteri uang dan menteri bumn tuntas kasus jiwasraya
406,instruksi dan selesai kasus dan
407,presiden jokowi instruksi menteri uang dan menteri bumn tuntas kasus jiwasraya
408,instruksi dan selesai kasus dan
409,staf khusus menteri bumn arya sinulingga beber langkah yang akan laku menteri bumn erick thohir dalam rapi bisnis hotel milik bumn yang induk tidak milik core bisnis hotel selasa
410,staf khusus menteri bumn arya sinulingga beber langkah yang akan laku menteri bumn erick thohir dalam rapi bisnis hotel milik bumn yang induk tidak milik core bisnis hotel selasa
411,triawan munaf mantan kepala bekraf tunjuk jadi komisaris utama garuda indonesia
412,triawan munaf mantan kepala bekraf tunjuk jadi komisaris utama garuda indonesia
413,selamat ulang tahun ke tahun moga garuda mau ajar dari salah yg laku dan ajar jg bisa terima ritikan foto lapang udara supadio pontianak
414,irfan setiaputra tunjuk jadi bos garuda indonesia ganti ari askhara
415,udah mblewer kali
416,polisi garap pramugari yang tuduh punya hubung dengan eks dirut garuda
417,ini rumah apa hall si rame bat sama orang pada kunjung apa mo nonton konser woi
418,alas siwi sidi baru buka suara kait rekan kerja mantan dirut garuda
419,heri akhyar mantan petinggi garuda dekat siwi sidi
420,mantan pacar lama uhuk ariaskhara uhuk
421,
422,
423,saat bicara soal ajaib dunia orang luput sebut otak bagai salah satu padahal dari otak lahir ajaib dunia
424,wkwkwkkwkwkwkw asu
425,
426,
427,
428,
429,
430,eksklusif pria indonesia hukum umur hidup atas kasus perkosa besar dalam sejarah di inggris
431,ssst ada om ari
432,pokok el kalau kroni si ariaskhara belum di bersihin dari garuda kita ngak bakal bosen el
433,apa hubung ama gabener banjir pompa air normalisasi  naturalisasi
434,kap pwc ga bener
435,pwc revisi lapor
436,dokumen rahasia taek itu cm hasil audit kap pwc apa lo ga tau pwc bakal di panggil dpr kemenkeu krna duga bkin lapor audit ga bener
437,bentar gw masih mau nanyak ma el bang tunggu di sini ya
438,dah gw baca lo mau gw komentar apa
439,politikus pdip cecar polisi lamban pidana eks dirut garuda ari askhara
440,kuak sosok selir yang libat skandal asmara eks dirut garuda ari askhara
441,ucap banjir kecam
442,tulis yg perlu kita kupas kait dan
443,
444,mantan cawapres ri ini ngaku teman dekat ari askhara ungkap hal yang buat ubah
445,tak bisa lagi foya foya pakai duit negara ari askhara kini paksa gig lewat
446,pecat erick thohir begini nasib ari askhara mantan dirut garuda kini jadi penggangguran
447,bin tegas eks direktur garuda ari askhara bukan anggota mereka hal ini susul banyak isu yang edar di media sosial bahwa ari askhara anggota bin
448,semua out kuasa ari askhara dan direktur kuak rangkap jabat komut bawah usaha
449,juru bicara menteri bumn arya sinulingga tak tampik kabar itu arya dengan terus terang sebut bahwa kabar itu juga terima
450,ari askaha minta tinggal jabat di anak cucu usaha garuda indonesia
451,main main nih om
452,wkwkkwkwk
453,pernah bikin murka chairul tanjung skandal di garuda pada masa pimpin ari askhara
454,boeing oleh condet digital lewat
455,jadi target menteri bumn erick thohir heran akan jumlah anak usaha yang milik pt pertamina persero
456,nasib apes ari askhara cs eliminasi dari garuda dan tendang dari k lewat
457,gudang jabat ari askhara di anak usaha garuda lewat
458,kan usaha engkong
459,nah gebrak apa saja yang telah laku erick thohir lama hari kerja yuk intip infografis gebrak hari menteri bumn erick thohir
460,apa saja gebrak hari menteri bumn kita erickthohir penasaran simak infografisnya yuk
461,halo tidak asa sudah hari bpk erick thohir jabat bagai menteri bumn ri yuk kita liat infografis gebrak yang telah laku oleh bapak menteri kita ini
462,hai hari ini tepat hari bapak jabat bagai menteri di simak gebrak beliau dalam infografis ikut ini
463,mantap lanjut pak erick
464,happy weekend
465,mantap memang mantap moga bawa ubah yang positif dan sukses yang lebih untuk pertamina
466,mantul
467,selamat jalan tugas moga lantik pun dapat jalan dengan lancar juga semangat selalu
468,selamat jalan tugas bapak erick thohir moga amanah ya pak dalam jalan tugas dan bawa bumn jadi lebih baik lagi untuk ekonomi indonesia
469,aksi nyata kerja
470,selamat kerja dan moga bisa lebih baik lagi ke depan
471,makin sukses dan maju selalu pak erick dan makin banyak gebrak dan hal hal baik yg akan laku moga makin manfaat bagi bangsa ini
472,sukses selalu untuk pak menteri moga gebrak jalan sesuai dengan apa yang harap
473,sukses selalu pertamina moga apa yang kerja dan langkah yang ambil dapat jalan dengan lancar dan lantik ini juga dapat jalan dengan lancar
474,keren banget nih
475,luar biasa sekali pak thohir moga bisa konsisten dengan bijak
476,gebrak hari menteri bumn erick thohir
