,text
0,larang erick tohir kepada bumn untuk diri anak usaha dan benruk jv
1,larang erick tohir kepada bumn untuk diri anak usaha dan benruk jv
2,larang erick tohir kepada bumn untuk diri anak usaha dan benruk jv
3,larang erick tohir kepada bumn untuk diri anak usaha dan benruk jv
4,induk anak cucu usaha ada cicit usaha jg kali et dah itu usaha beranakpinak iya kalo beranakpinak untung kalo merugikanberanakpinak rugi
5,indah dunia banyak jabat banyak uang oh indonesia riwayat kini sikat pak erickthohir kami rakyat sama sih pegawai brengsek yg tidak akhlak
6,untuk hal yg baik patut kita dukung
7,kereeen
8,jangan ngancem ngancem pak ee terjun bebas kau lah kami
9,perintah serius berantas mafia migas jangan sampai usaha pertamina gerogot oknum tak tanggung jawab
10,tuju bos
11,perintah sudah keluar surat untuk pilih direksi sementara dan henti jabat lima direksi garuda belum di enam usaha
12,maskapai garuda adalah maskapai terbang baik indonesia kasus yang saat ini sedang cuat kait garuda harus benah dan jangan sampai bawa merosot dan rugi lebih jauh
13,bola luncur ke bukti saji bisa laku lidi
14,
15,
16,
17,menteri bumn larang diri anak usaha dan join venture
18,saat
19,dirut garuda aa suruh undur diri oleh pak mnteri masih mau ngeles sekarang malah potensi henti dgn tidak hormat
20,
21,ciaapp laksana pleciden kawal uang negara arti kawal uang rakyat menteri badan usaha milik negara bumn rombak jajar urus di anak usaha pt inalum persero atau holding tambang mind id yaitu antam
22,mantull
23,ciaapp laksana pleciden kawal uang negara arti kawal uang rakyat menteri badan usaha milik negara bumn rombak jajar urus di anak usaha pt inalum persero atau holding tambang mind id yaitu antam
24,mantull
25,
26,
27,semua bumn kenapa pada korup si ah aing mahberdampak ke layan soal
28,dukung full langkah pak utama smoga bumn lain sisir bersih
29,kalau bisa semua yg rugi terus mau harus di semua pak dan orang yg baru juga jangan orang yekan yeekan
30,saat
31,sapu bersih om menteri bumn erick thohir henti direksi garuda indonesia yang kait kasus ari askhara
32,luar binasa para jabat garuda ini pantesan bumn rugi wae codot koruptor ngendong semua sini
33,
34,radikalisme tidak bisa hidup di indonesia
35,radikalisme tidak bisa hidup di indonesia
36,radikalisasi di bumn harus tumpas habis
37,
38,erick thohir akan ikut masuk dan perintah dari menko polhukam yang telah jabar radikalisasi di bumn dan langkah yang harus laku
39,benah bumn baik bumn basmi radikalisme di bumn
40,ideologi tidak bisa tawar nkri pancasila dan bhinneka tunggal ika adalah harga mati
41,
42,bersih tangkapin rampok jiwasraya
43,bersih tangkapin rampok jiwasraya
44,kami dukung pak untuk baik bumn agar lebih professional dan bukan lahan bancak jumlah oknum berengsek bagai lintah isap diam diam dari dalam
45,kami dukung pak untuk baik bumn agar lebih professional dan bukan lahan bancak jumlah oknum berengsek bagai lintah isap diam diam dari dalam
46,coba kita lihat berapa cepat naik taggar ini banding cc
47,yo yo ayoo yo ayo yo dukung pak tri
48,coba kita lihat berapa cepat naik taggar ini banding cc
49,yo yo ayoo yo ayo yo dukung pak tri
50,berkah komut baru
51,berkah komut baru
52,seoptimis apa program menteri yang baru bisabenar benar milik integritas dan hati nurani hm
53,seoptimis apa program menteri yang baru bisabenar benar milik integritas dan hati nurani hm
54,semenjak bongkar busuk satu masalah internal mulai kuak salah satu skandal leceh para pegawai wanita menteri bumn janji cegah leceh seksual di bumn
55,
56,cemilan anak
57,irfan setiaputra akhir resmi tunjuk jadi direktur utama pt garuda indonesia baca lengkap di
58,garuda indonesia punya dirut baru hal itu umum pada rupslb persero yang gelar hari ini rabu ini profil irfan setiaputra
59,garuda indonesia punya dirut baru hal itu umum pada rupslb persero yang gelar hari ini rabu ini profil irfan setiaputra
60,garuda indonesia punya dirut baru hal itu umum pada rupslb persero yang gelar hari ini rabu ini profil irfan setiaputra via
61,pt garuda indonesia persero tbk pada hari ini rabu rencana tetap direktur utama dan komisaris utama baru dalam rapat umum pegang saham luar biasa atau rupslb
62,moga telah masalah bangsat ini harga pesawat garuda turun turun turun
63,pramugari senior benar ulah selir mantan kini puter pilih sendiri
64,ungkap cara mantan temu awak kabin nyata direksi kita gin
65,skandal gundik dirut garuda selir dan lain lengkap dalam bentuk video jangan lupa like dan subscribe terima kasih d link via
66,semua out kuasa ari askhara dan direktur kuak rangkap jabat komut bawah usaha
67,erick thohir dan komisaris garuda tunjuk direksi sementara garuda mereka akan tugas hingga tetap anggota direksi pada saat rupslb januari datang
68,kl yg lain fokus ama oplasnya pra gundik ak tuh mikir awal mrk ga cakep amat trs oplas tp knp si laki tetap kepincut ga bs lepas dr para gundik why brrti ad nyaman ga cm fisik ranjang tp ad yg gundik kasih selain itu smw apa y
69,hahaha lha aku jarang buka twitter og ki diwnload meneg goro
70,twit muww pesona lanjut bongkar bobrok serta jajar
71,seri ini makin rame dan seru mudah panjang ga kaya sinetron sandung
72,boeing oleh condet digital lewat
73,cc bpk presiden
74,belum tuhan buka aib kalian boleh jadi sangat di hormat oleh teman kalian bahkan tetangga sanak sodara semua taruh hormat saat tuhan buka aib mu makaand
75,skandal gundik dirut garuda selir dan lain lengkap dalam bentuk video jangan lupa like dan subscribe terima kasih d link via
76,lima direktur pecat ini direksi sementara garuda indonesia dan tugas
77,rencana gw mau sunah rosul el gegara ini jadi gagal
78,nauzubillahimindzalik ya allah
79,skandal gundik dirut garuda selir dan lain lengkap dalam bentuk video jangan lupa like dan subscribe terima kasih d link via
80,pramugari cantik ini unggah foto puisi seperti ungkap asa olah ia rasa puas
81,listen to the most recent episode of my podcast bagaimana selingkuh bisa jadi
82,gundik
83,tuding leceh ojol ojek online iis dahlia jadi trending topic di twitter pasal ia sempat kait kerja sang suami satrio dewandono bagai pilot dengan profesi ojek online
84,waduh ada juga yang bela
85,kepala badan narkotika nasional bnn provinsi papua akan tindak tegas edar narkoba
86,mantan anak buah di pt jasamarga bal tol bela ari ashkara
87,kiano
88,
89,pernah gak mikir kalo gundik itu tingkat di atas cewe yg dizalimin suami pacar dipake doang tapi gak kasi nafkah duit gak bener nya emang krn jadi perempuan ya hrs ada harga diri toh
90,
91,garagara brompton titik rusak susu segaruda
92,ayo pak usut tuntas semua kapan perlu tanya tanya ama buat cerita detail
93,bolak balik twitter buat baca thread garuda itu loh
94,nonton ngakak nya sampe segitunya mbak bisa aja bikin kolaborasi acara malam ini
95,skandal gundik dirut garuda selir dan lain lengkap dalam bentuk video jangan lupa like dan subscribe terima kasih d link via
96,skandal gundik dirut garuda selir dan lain lengkap dalam bentuk video jangan lupa like dan subscribe terima kasih d link via
97,skandal gundik dirut garuda selir dan lain lengkap dalam bentuk video jangan lupa like dan subscribe terima kasih d link via
98,lah yo main moge tapi juga wedokan laki brengsek ya brengsek aja tetep laki pgn hobi mobilmotor ya pake alas biar ga wedokan biar izin turun
99,yaps tiga aib kuak maka takut rajalela dan kinj mereka lapor orang orang yang telah memplubikasikan aib mereka
100,ini klarifikasi cyndyana lorens
101,simak tutur
102,foucault power and knowledge power and pussy
103,
104,itu gundik dirut gak ada yang lebih cakep apa padahal udah kena oplas muka
105,makanya bini ajak dah juga dong di fraser place setiabudi
106,tell us how you really feel
107,komisi vi desak dirut garuda jelas duduk perkara selundup harley davidson
108,ga abis pikir sama ini eh mantan deng udah belum pernah mark up lapor uang garuda yg harus rugi jadi untung terus ini jelas tau dan dihimbau dari kemaren utk segera mundur tapi malah nunggu sampe copot parah deh bener
109,tuju sih bu jadi yang baru cara bu sus punya alam di bidang terbang kan punya maskapai juga lagi kurang apa lagi coba
110,explore jastip moge hd n sepeda brompton pake airbus a negara level
111,so much for criminalizing business passengers just few months ago now he himself facing criminal charges
112,gilak udah jabat paling tinggi di usaha perintah gaji pasti gede masa mau beli motor aja pakai nyuri segala
113,pecatttttt nih dirut cuma buat malu negara
114,
115,nanggung kalo emang tidak akan buka ke publik buat apa ada cuit ini cari panggung cc
116,dirut garuda ancam copot kait kasus harley inaca sayang itu
117,wa
118,wa
119,
120,wa
121,kuat lemah
122,wa
123,wa
124,ngentot vangsat laknaaaaaaaat ya allah moga ini orang segera ke tangkep
125,pecat erick thohir begini nasib ari askhara mantan dirut garuda kini jadi penggangguran
126,skandal gundik dirut garuda selir dan lain lengkap dalam bentuk video jangan lupa like dan subscribe terima kasih d link via
127,kenal direksi sementara dan apa yang perlu baik garuda indonesia
128,skandal gundik dirut garuda selir dan lain lengkap dalam bentuk video jangan lupa like dan subscribe terima kasih d link via
129,barangkali seperti ini ya min
130,usai ari baskara sang istri i gusti ayu rai dyana dewi juga jadi sorot bukan orang sembarang via
131,berani juga ya dirut garuda nyeludupin harley davidson di pesawat gw nyeludupin airputih ke bioskop aja deg degan
132,ada yang usul agar menteri bumn erick thohir tunjuk ignasius jonan bagai dirut garuda ganti ari askhara
133,gaya seperti presiden soekarno di ingat hut ri dirut garuda dik via
134,
135,brani juga dirut garuda selundupin harley davidson ke pesawat ya gua nyoba nyelundupin anak orang ke kamar kos aja degdegan
136,sosok serba mewah ari askhara ungkap tetangga selalu tidur hotel me lewat
137,harus cepat proses hukum semua direksi garuda yg libat jahat itu belum barang bukti lenyap ayo para awak kabin yg rasa rugi segera buat adu ke tegak hukum agar bongkar semua
138,kenapa ya para aparat tegak hukum belum merespon kasus langgar hukum ari askhara ini kok malah lebih gesit gera pak erick thohir gemess liat
139,
140,ambil pinjam bank pun rakyat jelata pasti msh tanya macem lengkap berkas ini itu g lengkap wassalam rakyat misqeen larang julid org macam ini mudah jlnnya di indo
141,mau kasih tau takut jadi ghibah mending cari tau sendiri aja dan wkwkw
142,sosok istri ari askhara i gusti ayu rai dyana dewi nyata juga ikut ada di pesawat garuda indonesia saat selundup harley davidson dan barang lain jadi
143,curhat soal ari askhara ikagi berani protes langsung kena sanksi via dirut garuda ari askhara
144,aku tetangga dirut garuda ari askhara pilih tidur di hotel tidak di rumah saat pulang kampung lewat
145,before and after oplas
146,harga sepeda brompton jt an  jt an harga harley jt  jt gaji direksi jt an kok masih mau lari dari pajak sih
147,
148,kembali jamah dunia twitter garagara thread
149,nama garuda kan tarik jadi banyak masuk banyak tiga kandidat lebih itu kita cari kandidat baik untuk garuda ungkap staf khusus menteri bumn arya sinulingga via
150,menteri badan usaha milik negara bumn erick thohir aku sudah ada nama calon direktur utama garuda indonesia untuk ganti ari askhara yang copot beberapa waktu lalu baca lengkap klik
151,nama garuda kan tarik jadi banyak masuk banyak tiga kandidat lebih itu kita cari kandidat baik untuk garuda ungkap staf khusus menteri bumn arya sinulingga via
152,menteri badan usaha milik negara bumn erick thohir aku sudah ada nama calon direktur utama garuda indonesia untuk ganti ari askhara yang copot beberapa waktu lalu baca lengkap klik
153,siapa dirut garuda indonesia akan putus saat rapat umum pegang saham luar biasa rupslb pada januari nanti
154,jakarta fixindonesia com pramugari garuda siwi widi purwanti yang sempat jadi perhati publik beberapa waktu lalu sempat hubung dengan kasus yang jegal mantan dirut garuda ari askhara
155,siapa dirut garuda indonesia akan putus saat rapat umum pegang saham luar biasa rupslb pada januari nanti
156,jakarta fixindonesia com pramugari garuda siwi widi purwanti yang sempat jadi perhati publik beberapa waktu lalu sempat hubung dengan kasus yang jegal mantan dirut garuda ari askhara
157,tunjuk jadi dirut garuda irfan setiaputra sempat degdegan tapi excited
158,simak profil dari direktur utama garuda indonesia irfan setiaputra
159,tunjuk jadi dirut garuda irfan setiaputra sempat degdegan tapi excited
160,simak profil dari direktur utama garuda indonesia irfan setiaputra
161,buntut kasus harley dan bromptom ari askhara ancam penjara katusba media berita inspiratif percaya via
162,video karma instant gundik seksi putri novita ramli usai tamat jadi pelakor dirut garuda
163,buntut kasus harley dan bromptom ari askhara ancam penjara katusba media berita inspiratif percaya via
164,video karma instant gundik seksi putri novita ramli usai tamat jadi pelakor dirut garuda
165,ghibah nasional lanjut yg penting pesan untuk rombak usaha bumn sampai ke pak lanjut iris tipis el
166,wauuu ini bukan hanya sekendar ancam kaleng kaleng ayooo cepat bena jika tdk mau borok makin buka ke publik netizen dukung bung arya n dengar wakil suara rakyat segera beres mafia maling cabul di garuda
167,saat nya tunggu putus depan soal garuda
168,semangat kerja
169,
170,wow
171,auto miskin
172,nanti pasti sangkal ngelesitu oknum kumpul oknum yg jiwa dan ber hati sama bentuk ormas
173,ini acara sudah pecat sama kang kayak ya koq masih boleh ngumpulin csnya
174,aamiin yra
175,aamiin yra
176,bandar lampung tri
177,
178,takbeerr haleluya
179,ashiaaaapp mbak mari kita sama dukung pak
180,done kabeh
181,harap jangan ini saja masih banyak bumn lain yang belum kelola scr profesional
182,
183,dukung terus bersih di seluruh bumn agar indonesia maju
184,done
185,
186,jgn hanya henti dirut garuda tapi selidik dan sikat habis dengan oknum yang dukung bejat dirut garuda udh rugi uang negara tapi laku dan kerja nya bajing kasihan karyaean yang rugi
187,
188,titip
189,
190,done all
191,
192,
193,done
194,
195,done
196,rini mungkin lama ini dpt layan khusus dr pramugara atau pilot garuda ninabobo
197,tau tahu
198,
199,
200,bayang kalo shopee itu buah mall dan banyak lapak itu kek apa gedung berapa lantai banyak blok mindblowing
201,
202,done
203,
204,
205,
206,
207,
208,
209,cerita belum habis arogansi selir sayang ari askhara kian bongkar via besok desember i
210,
211,
212,
213,
214,bapak tahu gunung kelud aki pernah nantangin gelud tuh gunung tapi gunung diem aje apa mesti kita gelud dulu ama mereka baru perintah tindak
215,sapu bersih
216,
217,
218,
219,
220,asa begitu berat tugas pak dan garuda belum selesai datang jiwasraya asabri dan juga belum tuntas
221,
222,asa begitu berat tugas pak dan garuda belum selesai datang jiwasraya asabri dan juga belum tuntas
223,
224,tuding terima suap miliar erick ada pihak yang gerah
225,hajar
226,tuding terima suap miliar erick ada pihak yang gerah
227,hajar
228,
229,
230,
231,
232,
233,siapa lagi sasar ikut dari erick thohir top markotob pasti banyak yang kayak cacing panas di bumn
234,menteri bumn erick thohir sedang jadi media darling belakang ini sejak pilih jadi menteri bumn yang umum bulan oktober oleh presiden jokowi erick thohir segera tancap gas laku jumlah gebrak
235,makin tinggi jabat kau akan makin tau berapa kotor dunia ini tinggal pilih hanya diam dan dar tau atau terjun di dalam ya bu rini soemarno
236,
237,ini kronologi kuak selundup komponen harley davidson hingga menteri bumn erick thohir harus henti dirut garuda indonesia
238,erick thohir pecat dirut pt garuda indonesia
239,sih pak
240,ghibah fenomenal akhir tahun bongkar skandal di tubuh garuda wancine resik bumn
241,menteri bumn erick thohir tanggap viralnya informasi di media sosial kait duga leceh pramugari oleh direksi garuda indonesia
242,menteri bumn erick thohir buka suara respons jabat garuda indonesia yang tuding germo oleh akun apa kata erick via
243,
244,menteri bumn erick thohir buka suara respons jabat garuda indonesia yang tuding germo oleh akun apa kata erick
245,menteri bumn erick thohir tunjuk royke tumilaar bagai direktur utama bank mandiri siapa roykee tumilaar
246,
247,untuk urus canda beliau begitu serius apalagi untuk urus serius beliau pasti tidak canda tulis bedu
248,
249,yakin investor global ini agenda menteri bumn erick thohir di singapura
250,cerita belum habis arogansi selir sayang ari askhara kian bongkar via besok desember i
251,
252,
253,bahas selundup di garuda karni ilyas sebut biasa arya sinulingga ungkit komitmen erick thohir
254,gilir sidi siwi bantah tuding jadi gula bos garuda indonesia via main yuk
255,
256,tuju sapu bersih
257,papa erick emg keren deh semangat bersih pah
258,skandal jiwasraya belum tuntas kini geger duga korupsi asabri rp t via
259,
260,menteri bumn erick thohir sudah panggil direktur pt asabri dan akan temu menko polhukam mahfud md untuk sampai hasil via
261,jakarta  menko polhukam mahfud md aku sudah dengar ada audit badan periksa uang bpk hadap pt asabri persero bahkan turut ada duga korupsi rp triliun dari dana yang kumpul dari para prajurit tni itu saya
262,menteri bumn erick thohir sebut putus rombak banyak jajar direksi dan komisaris bumn adalah hal yang biasa hal itu laku untuk segar pimpin di usaha pelat merah
263,erick thohir window dressing lapor uang bisa juga kategori bagai tindak pidana alias kriminal
264,menteri bumn erick thohir sebut putus rombak banyak jajar direksi dan komisaris bumn adalah hal yang biasa hal itu laku untuk segar pimpin di usaha pelat merah
265,mahfud duga ada korupsi di atas rp triliun dari uang yayasan yang kumpul dari para prajurit tni mahfud akan panggil erick tohir dan sri mulyani
266,menteri bumn erick thohir kata bentuk joint venture ini rupa tindak lanjut dari arah presiden joko widodo agar kelola moda transportasi di ibu kota bisa laku integrasi
267,menteri bumn erick thohir cerita saat ia kunjung ke kantor anies baswedan di awal masa jabat begini cerita
268,menteri bumn erick thohir cerita saat ia kunjung ke kantor anies baswedan di awal masa jabat begini cerita via
269,menteri badan usaha milik negara bumn erick thohir kata bahwa rapat pegang saham luar biasa rups lb garuda indonesia pasti ada tanggal januari siapa direktur utama baru ganti ari askhara
270,ini yang sering jadi di bumn adalah window dressing lapor uang kalau window dressing lapor uang itu masuk tindak bisa kriminal
271,ini yang sering jadi di bumn adalah window dressing lapor uang kalau window dressing lapor uang itu masuk tindak bisa kriminal via
272,salah satu yang lagi hot jiwasraya tetap kita tidak mau lempar kita akan pasti kita cari jalan kita selamat kata erick via
273,salah satu yang lagi hot jiwasraya tetap kita tidak mau lempar kita akan pasti kita cari jalan kita selamat kata erick
274,menteri bumn erick thohir kata bentuk joint venture ini rupa tindak lanjut dari arah presiden joko widodo agar kelola moda transportasi di ibu kota bisa laku integrasi
275,menteri badan usaha milik negara bumn erick thohir pasti perintah tidak akan lepas tangan
276,
277,erick thohir bungkam politikus demokrat kan fakta kasus jiwasraya sejak zaman sby
278,erick thohir bungkam politikus demokrat kan fakta kasus jiwasraya sejak zaman sby
279,demi bongkar skandal di garuda menteri bumn erick thohir kirim pesan wa ke hotman paris isi via
280,kait bangun kilang pt tppi tuban presiden kepada erick thohir minta tadi empat tahun tiga tahun harus rampung semua
281,biasa ngisi token listrik rb isi rp skarang hanya isi rp bagaimana nih pln naikinnya kok diam tanpa di umum ke konsumen nama apa nih kalo diam naikin cc
282,rudiantara jadi dirut pln
283,erick thohir memang pantas ter or lewat
284,erick thohir umum dirut pln senin pekan depan
285,nanti juga akan buka outlet di bandara yang memang jadi pusat tuju wisata
286,
287,
288,agree
289,ingin motor keren dengan harga bawah pasar dan aman di jalan bilah harley davidson bodong
290,
291,
292,boleh kasi judul beras bancak opo ora papar
293,jadi paham kenapa mobil hd kalau lewat jalan umum bisa cepat garuda
294,suami terbang pesawat harley iis dahlia ngaku capek via dirut garuda
295,
296,suami terbang pesawat harley iis dahlia ngaku capek via dirut garuda
297,
298,makanya bini ajak dah juga dong di fraser place setiabudi
299,org kaya nanggung tapi ingin gaya sultan jadi sama kyk para milik mobil mewah di jkt yg pada gakuat byr pajak
300,
301,
302,mau tanya tweeter ini scrol ke bawah atau atas buat updete baru
303,siapa tau ada yang suka
304,butuh sekil tinggi untuk bisa selundup harley ke garuda
305,di wisma rohas perkasa
306,pantas aja thn lalu sdh ingat garuda bakal rugi lama alami rugi mslh pajak kena denda hingga rekayasa lap uang agar tampak raup laba gk tau melihara tikus dirut anak emas rini rini anak emas siapa tau sendiri
307,kenapa si thohir lagak pahlawan keluwarganya saja selundup meski bukan lewat garuda
308,satu demi satu bukti bahwa pesawat adalah angkut illegal logistik milu senjata cina rupiah harus lion air juga selain garuda
309,cek saham giaa besok
310,ga cuma copot selundup harus pidana
311,
312,yang lagi ngetrend sejati bener kata om iwan fals ingin adalah sumber derita
313,bapak erick thohir mantul jg bhongkar semua pak bhongkarrrrr
314,pajakpoker  situs main kartu online baik di indonesia contact us link
315,gasss
316,pajakpoker  situs main kartu online baik di indonesia contact us link
317,pajakpoker  situs main kartu online baik di indonesia contact us link
318,ivy is really feeling kite man
319,ivy is really feeling kite man
320,ayo ayo di sidik dan di jelas ke bangsa inijangan lah para jabat negeri ini jadi pembajaknegara butuh jabat yg nurani baik untuk maju negarabukan jadi rampok sembunyi
321,menteri badan usaha milik negara bumn akan rapi bisnis hotel yang milik bumn rencana kelola hotel bumn akan satu
322,erick thohir ganti dewan komisaris pt pertamina
323,pt pertamina persero beri mandat untuk implementasi b mulai awal tahun
324,menteri bumn erick thohir tunjuk zulkifli zaini bagai direktur utama pln dan amien sunaryadi bagai komisaris utama pln
325,erickthohir kasus hukum yang jadi di jiwasraya akan tangan oleh pihak jaksa
326,kait dirut baru pln erick thohir pak rudiantara salah satu kandidat nanti jam putus
327,larang erick tohir kepada bumn untuk diri anak usaha dan benruk jv
328,larang erick tohir kepada bumn untuk diri anak usaha dan benruk jv
329,larang erick tohir kepada bumn untuk diri anak usaha dan benruk jv
330,larang erick tohir kepada bumn untuk diri anak usaha dan benruk jv
331,bumn watch minta anak cucu usah bumn tertib
332,bumn harap tingkat csr jadi persen untuk didik
333,erick thohir dan komisaris garuda tunjuk direksi sementara garuda mereka akan tugas hingga tetap anggota direksi pada saat rupslb januari datang
334,salut integritas menteri yg satu ini layak contoh oleh para menteri dan jabat lain yg ada di negeri ini
335,nal dengan direksi sementara garuda indonesia dan fokus garuda lama hari ke depan
336,erick tohir tertawa lepas dengar cucu bumn garuda nama tauberes indonesia
337,menteri bumn yang tarik mohon maaf buat saya sih gelitik ada cucu garuda nama pt garuda tauberes indonesia
338,erick thohir sebut tetap dirut pln masih dalam proses
339,erick thohir saya rasa kena pln masih dalam proses ya mudah minggu ini bisa putus karena kan masih ada sabtu dan minggu
340,presiden dalam arti kategori cari figur yang memang alam karena kan memang kalau listrik ini sangat jadi krusial
341,waduuuhh bantai massal sapu bersih pak jabat yg tak akhlak
342,di hujung tahun menteri bumn erick thohir laku ombak dewan direksi di pt asdp indonesia ferry
343,kutip dr laman video ini smsa menteri sblmnya mnjbat tk kunjung klar
344,menteri badan usaha milik negara bumn erick thohir tampak begitu masif jalan misi untuk bersih anak dan cucu milik usaha bumn
345,jabat bagai komisaris utama pertamina ahok bakal berantas mafia migas
346,lah koq diam saja om
347,mas erickthohir we ll support your integrity for better indonesia
348,dirut garuda selundup harley erick thohir i am going to end this man whole career
349,larang untuk beri suvenir atau jenis kepada siapa cetus erick
350,sejak awal yakin pak pasti akan bikin banyak gebrak dalam pimpin menteri bumn
351,netizen pak masih nantang neh pak dirut garuda
352,dirut garuda indonesia henti presiden jangan main
353,garagara harley davidson ari askhara harus tinggal garuda indonesia simak video di sini
354,kalau jabat masih main curang akhlaw nya sudah rusak bravo
355,saat laku konferensi pers di menteri uang kamis menteri bumn erick thohir aku sedih atas insiden selundup moge harley davidson yang nyata milik dirut garuda indonesia
356,menteri bumn erick thohir pecat dirut garuda indonesia ari askhara kait selundup harley dan dua sepeda brompton dalam pesawat baru garuda cek berita
357,erick thohir ancam pidana dirut garuda dan anak buah
358,erick thohir ungkap milik harley davidson duga punya dirut garuda
359,hei qc jog hlp etd sampai skrg blm brangkat juga info nya traffic padat tp drtd psawat lain sdh pd brangkat gmana sih gada announcement nya
360,erick thohir bongkar pasang urus pt antam ada apa katusba media berita inspiratif percaya via bumn desember
361,hei qc jog hlp etd sampai skrg blm brangkat juga info nya traffic padat tp drtd psawat lain sdh pd brangkat gmana sih gada announcement nya
362,erick thohir bongkar pasang urus pt antam ada apa katusba media berita inspiratif percaya via bumn desember
363,me dol mucho pero aprend mucho
364,menteri bumn erick thohir tunjuk royke tumilaar bagai direktur utama bank mandiri siapa roykee tumilaar
365,garagara harley davidson ari askhara harus tinggal garuda indonesia simak video di sini
366,sedang langsung live streaming ilc tv one ketika garuda serempet moge ari askhara hadir via
367,intip seru menteri jokowi ini
368,amat nyata jokowi ingin berantas korupsi garing
369,gebrak baru
370,dirut direksi pecat bobrok manajemen garuda bongkar
371,kocakk mantaap video lengkap drama menteri di hari anti korupsi dunia
